{
  "apiVersion": "noemaforge.typed-governance/v1",
  "kind": "TypedGovernanceTrackPolicy",
  "id": "typed-governance-track-core",
  "version": "0.32.2",
  "status": "shadow",
  "policy": {
    "mode": "offline_contract",
    "require_trace_id": true,
    "require_dependency_order": true,
    "require_registry_attachment": true,
    "require_policy_schema_runtime_tests": true,
    "require_docs_and_changelog_refs": true,
    "required_pipeline_ref": "pipeline:firstboot-model-selection:0.32.1",
    "required_stage_order": [
      "concept_frame",
      "sense_state_privacy",
      "drive_state",
      "honesty_protocol",
      "slop_critic",
      "detection_verdict",
      "research_packet",
      "pipeline_rfc"
    ],
    "required_contracts": [
      {
        "stage": "concept_frame",
        "eval_pack_ref": "eval-pack:concept-frame-governance-core:0.32.1",
        "policy_ref": "configs/concept-frame-policy.json",
        "schema_ref": "contracts/concept_frame.schema.json",
        "runtime_ref": "src/concept_frame_runtime.py",
        "test_refs": [
          "tests/test_concept_frame_runtime.py",
          "tests/test_concept_frame_qa.py",
          "tests/test_concept_frame_performance.py"
        ]
      },
      {
        "stage": "sense_state_privacy",
        "eval_pack_ref": "eval-pack:sense-privacy-governance-core:0.32.1",
        "policy_ref": "configs/sense-privacy-policy.json",
        "schema_ref": "contracts/sense_privacy.schema.json",
        "runtime_ref": "src/sense_privacy_runtime.py",
        "test_refs": [
          "tests/test_sense_privacy_runtime.py",
          "tests/test_sense_privacy_qa.py",
          "tests/test_sense_privacy_performance.py"
        ]
      },
      {
        "stage": "drive_state",
        "eval_pack_ref": "eval-pack:drive-state-governance-core:0.32.1",
        "policy_ref": "configs/drive-state-policy.json",
        "schema_ref": "contracts/drive_state.schema.json",
        "runtime_ref": "src/drive_state_runtime.py",
        "test_refs": [
          "tests/test_drive_state_runtime.py",
          "tests/test_drive_state_qa.py",
          "tests/test_drive_state_performance.py"
        ]
      },
      {
        "stage": "honesty_protocol",
        "eval_pack_ref": "eval-pack:honesty-protocol-governance-core:0.32.1",
        "policy_ref": "configs/honesty-protocol-policy.json",
        "schema_ref": "contracts/honesty_protocol.schema.json",
        "runtime_ref": "src/honesty_protocol_runtime.py",
        "test_refs": [
          "tests/test_honesty_protocol_runtime.py",
          "tests/test_honesty_protocol_qa.py",
          "tests/test_honesty_protocol_performance.py"
        ]
      },
      {
        "stage": "slop_critic",
        "eval_pack_ref": "eval-pack:slop-critic-governance-core:0.32.1",
        "policy_ref": "configs/slop-critic-policy.json",
        "schema_ref": "contracts/slop_critic.schema.json",
        "runtime_ref": "src/slop_critic_runtime.py",
        "test_refs": [
          "tests/test_slop_critic_runtime.py",
          "tests/test_slop_critic_qa.py",
          "tests/test_slop_critic_performance.py"
        ]
      },
      {
        "stage": "detection_verdict",
        "eval_pack_ref": "eval-pack:provenance-watermark-verdict-core:0.32.1",
        "policy_ref": "configs/provenance-watermark-policy.json",
        "schema_ref": "contracts/provenance_watermark.schema.json",
        "runtime_ref": "src/provenance_watermark_runtime.py",
        "test_refs": [
          "tests/test_provenance_watermark_runtime.py",
          "tests/test_provenance_watermark_qa.py",
          "tests/test_provenance_watermark_performance.py"
        ]
      },
      {
        "stage": "research_packet",
        "eval_pack_ref": "eval-pack:research-packet-scouting-core:0.32.1",
        "policy_ref": "configs/research-packet-policy.json",
        "schema_ref": "contracts/research_packet.schema.json",
        "runtime_ref": "src/research_packet_runtime.py",
        "test_refs": [
          "tests/test_research_packet_runtime.py",
          "tests/test_research_packet_qa.py",
          "tests/test_research_packet_performance.py"
        ]
      },
      {
        "stage": "pipeline_rfc",
        "eval_pack_ref": "eval-pack:pipeline-rfc-mutation-core:0.32.1",
        "policy_ref": "configs/pipeline-rfc-policy.json",
        "schema_ref": "contracts/pipeline_rfc.schema.json",
        "runtime_ref": "src/pipeline_rfc_runtime.py",
        "test_refs": [
          "tests/test_pipeline_rfc_runtime.py",
          "tests/test_pipeline_rfc_qa.py",
          "tests/test_pipeline_rfc_performance.py"
        ]
      }
    ],
    "required_example_sets": [
      "prelaunch/governance/typed_governance_track.example.json"
    ]
  },
  "refs": [
    "noemaforge/configs/typed-governance-track.json",
    "noemaforge/contracts/typed_governance_track.schema.json",
    "noemaforge/src/typed_governance_track_runtime.py",
    "noemaforge/tests/test_typed_governance_track_runtime.py",
    "noemaforge/tests/test_typed_governance_track_qa.py",
    "noemaforge/tests/test_typed_governance_track_performance.py",
    "prelaunch/governance/typed_governance_track.example.json",
    "prelaunch/governance/pipeline_rfc.example.json",
    "docs/wiki/architecture/typed-control-plane-sense-critics-rfc-0.32.1.md",
    "docs/backlog/ROADMAP_AND_TODO.md",
    "noemaforge/docs/backlog/ROADMAP_AND_TODO.md"
  ]
}


